Name,unique_id,Year of Work,Auction House,Session,Meeting,Sale of,Description,Product URL,Image URL,Size,Category,Period,Estimate RMB,Sold For RMB,China,T,China*T,Estimate,Size_c,weights,subclass,Stratum
Qing Kangxi cowpea red glazed chrysanthemum petal vase,130,Qing Kangxi,Christie's,"Spring Auction 2003 - Fine Art, Ceramics and Crafts from the Chinese Imperial Court",Spring Auction 2003,07/07/2003,,https://auction.artron.net/paimai-art20510066,https://image.artron.net/wd/auction//31/art/599/085f2e5471cf38cb7fda50dd1c0a8ab7.jpg,21,Vase,Qing,530000,506680,0,1,0,530000.0,3,1.06683695189442,2,V2
Qing Yongzheng imitation official kiln convex drum string pattern neck vase,131,Qing Yongzheng,Christie's,"Spring Auction 2003 - Fine Art, Ceramics and Crafts from the Chinese Imperial Court",Spring Auction 2003,07/07/2003,,https://auction.artron.net/paimai-art20510085,https://image.artron.net/wd/auction//31/art/599/0ec6a47f1793fc052b7d62efaae47018.jpg,22,Vase,Qing,265000,532014,0,1,0,265000.0,3,1.06683695189442,2,V2
Qing Yongzheng kiln changed glaze to fight for amphora vase,133,Qing Yongzheng,Christie's,"Spring Auction 2003 - Fine Art, Ceramics and Crafts from the Chinese Imperial Court",Spring Auction 2003,07/07/2003,,https://auction.artron.net/paimai-art20510081,https://image.artron.net/wd/auction//31/art/599/c79e6a677c1eda6814bbbe628301909c.jpg,34,Vase,Qing,424000,443345,0,1,0,424000.0,4,0.976779287124115,1,V1
Qianlong furnace glaze Ruyi ear flat vase,134,Qing Qianlong,Christie's,"Spring Auction 2003 - Fine Art, Ceramics and Crafts from the Chinese Imperial Court",Spring Auction 2003,07/07/2003,,https://auction.artron.net/paimai-art20510083,https://image.artron.net/wd/auction//31/art/599/82730cbdd2bd3c6203f3ca78243f643c.jpg,33,Vase,Qing,1325000,1136055,0,1,0,1325000.0,4,0.976779287124115,1,V1
Qianlong of the Qing Dynasty imitated the official kiln three sacrifices vase,138,Qing Qianlong,Christie's,"Spring Auction 2003 - Fine Art, Ceramics and Crafts from the Chinese Imperial Court",Spring Auction 2003,07/07/2003,,https://auction.artron.net/paimai-art20510084,https://image.artron.net/wd/auction//31/art/599/6b97eb1efeb079311c24559cff3930f8.jpg,30,Vase,Qing,212000,253340,0,1,0,212000.0,4,0.976779287124115,1,V1
Qing Yongzheng Ji blue glazed vase,140,Qing Yongzheng,Christie's,"Spring Auction 2003 - Fine Art, Ceramics and Crafts from the Chinese Imperial Court",Spring Auction 2003,07/07/2003,,https://auction.artron.net/paimai-art20510111,https://image.artron.net/wd/auction//31/art/599/bd0e925607929b5fc888899d22d22b5b.jpg,28,Vase,Qing,212000,354676,0,1,0,212000.0,3,1.06683695189442,2,V2
Ming ChongZhen Blue and white water margin character picture cylinder vase,146,Ming Chongzhen,Christie's,"Spring Auction 2003 - Fine Art, Ceramics and Crafts from the Chinese Imperial Court",Spring Auction 2003,07/07/2003,,https://auction.artron.net/paimai-art20510154,https://image.artron.net/wd/auction//31/art/599/ef622aebf36165ade3229186077cd20e.jpg,43,Vase,Ming,143100,291341,0,1,0,143100.0,4,0.228607918263091,4,V4
Qing Dynasty 18th century multicolored dragon pattern flower vase pair,150,"Qing Dynasty, 18th century",Christie's,"Spring Auction 2003 - Fine Art, Ceramics and Crafts from the Chinese Imperial Court",Spring Auction 2003,07/07/2003,,https://auction.artron.net/paimai-art20510164,https://image.artron.net/wd/auction//31/art/599/57712a9beac02192fe3cc25ec626c801.jpg,46,Vase,Qing,63600,107670,0,1,0,63600.0,4,0.976779287124115,1,V1
Qing Kangxi Blue and white figure figure figure Phoenix Tail vase,156,Qing Kangxi,Christie's,"Spring Auction 2003 - Fine Art, Ceramics and Crafts from the Chinese Imperial Court",Spring Auction 2003,07/07/2003,,https://auction.artron.net/paimai-art20510161,https://image.artron.net/wd/auction//31/art/599/e83c35a9c2e4f50dc31ca63a101e09b6.jpg,79,Vase,Qing,424000,443345,0,1,0,424000.0,4,0.976779287124115,1,V1
Qing Kangxi Colorful horse riding lady figure skimming Guanyin vase,159,Qing Kangxi,Christie's,"Spring Auction 2003 - Fine Art, Ceramics and Crafts from the Chinese Imperial Court",Spring Auction 2003,07/07/2003,,https://auction.artron.net/paimai-art20510181,https://image.artron.net/wd/auction//31/art/599/3cf1e68f3e1606192a4e457c80547b87.jpg,47,Vase,Qing,477000,633350,0,1,0,477000.0,4,0.976779287124115,1,V1
Qing Jiaqing water chestnut vase with tea glaze,162,Qing Jiaqing,Christie's,"Spring Auction 2003 - Fine Art, Ceramics and Crafts from the Chinese Imperial Court",Spring Auction 2003,07/07/2003,,https://auction.artron.net/paimai-art20510171,https://image.artron.net/wd/auction//31/art/599/e090c53a3d221e74033c3db3eafda6b9.jpg,32,Vase,Qing,111300,88669,0,1,0,111300.0,4,0.976779287124115,1,V1
Qing Yongzheng Coral red glaze depicted gold pan dragon vase,165,Qing Yongzheng,Christie's,"Spring Auction 2003 - Fine Art, Ceramics and Crafts from the Chinese Imperial Court",Spring Auction 2003,07/07/2003,,https://auction.artron.net/paimai-art20510172,https://image.artron.net/wd/auction//31/art/599/11c5e129585c2d9dafaef6dab690498c.jpg,26,Vase,Qing,143100,278674,0,1,0,143100.0,3,1.06683695189442,2,V2
Qing Jiaqing bean green glazed gourd vase,168,Qing Jiaqing,Christie's,"Spring Auction 2003 - Fine Art, Ceramics and Crafts from the Chinese Imperial Court",Spring Auction 2003,07/07/2003,,https://auction.artron.net/paimai-art20510185,https://image.artron.net/wd/auction//31/art/599/273fe0c187037acb5001a703a1154e42.jpg,33,Vase,Qing,106000,114003,0,1,0,106000.0,4,0.976779287124115,1,V1
Qianlong Furnace Jun glaze pile ear vase,172,Qing Qianlong,Christie's,"Spring Auction 2003 - Fine Art, Ceramics and Crafts from the Chinese Imperial Court",Spring Auction 2003,07/07/2003,,https://auction.artron.net/paimai-art20510193,https://image.artron.net/wd/auction//31/art/599/56f21c65084bdfbee05b696e1156fdf6.jpg,24,Vase,Qing,143100,164671,0,1,0,143100.0,3,1.06683695189442,2,V2
Qianlong Qingquan white glaze ground blue and white glaze red landscape vase,173,Qing Qianlong,Christie's,"Spring Auction 2003 - Fine Art, Ceramics and Crafts from the Chinese Imperial Court",Spring Auction 2003,07/07/2003,,https://auction.artron.net/paimai-art20510203,https://image.artron.net/wd/auction//31/art/599/38121e9fe75ee2c146ec8f9269b3cb77.jpg,42,Vase,Qing,74200,76002,0,1,0,74200.0,4,0.976779287124115,1,V1
Qianlong Blue and white flowers wave pattern vase,174,Qing Qianlong,Christie's,"Spring Auction 2003 - Fine Art, Ceramics and Crafts from the Chinese Imperial Court",Spring Auction 2003,07/07/2003,,https://auction.artron.net/paimai-art20510189,https://image.artron.net/wd/auction//31/art/599/1d0de7a1a59aecc3ee1f6c74ea77e04d.jpg,52,Vase,Qing,439900,380010,0,1,0,439900.0,4,0.976779287124115,1,V1
Qing 19th century blue and white dragon pattern large prize vase,175,Qing Nineteenth Century,Christie's,"Spring Auction 2003 - Fine Art, Ceramics and Crafts from the Chinese Imperial Court",Spring Auction 2003,07/07/2003,,https://auction.artron.net/paimai-art20510205,https://image.artron.net/wd/auction//31/art/599/4890f0462b9e9c9e04794cf236ac4b68.jpg,90,Vase,Qing,63600,190005,0,1,0,63600.0,4,0.976779287124115,1,V1
Qianlong Blue glaze double elephant ear vase,177,Qing Qianlong,Christie's,"Spring Auction 2003 - Fine Art, Ceramics and Crafts from the Chinese Imperial Court",Spring Auction 2003,07/07/2003,,https://auction.artron.net/paimai-art20510188,https://image.artron.net/wd/auction//31/art/599/8c949ebdaf01cdbfba69e6fbd1fa8c8e.jpg,30,Vase,Qing,84800,114003,0,1,0,84800.0,4,0.976779287124115,1,V1
Qianlong kiln changed glazed pomegranate vase,178,Qing Qianlong,Christie's,"Spring Auction 2003 - Fine Art, Ceramics and Crafts from the Chinese Imperial Court",Spring Auction 2003,07/07/2003,,https://auction.artron.net/paimai-art20510194,https://image.artron.net/wd/auction//31/art/599/dd0ff26dca5b36dc2710693b4f495f02.jpg,20,Vase,Qing,143100,202672,0,1,0,143100.0,3,1.06683695189442,2,V2
Qianlong of the Qing Dynasty Pastel figure Guanyin vase,179,Qing Qianlong,Christie's,"Spring Auction 2003 - Fine Art, Ceramics and Crafts from the Chinese Imperial Court",Spring Auction 2003,07/07/2003,,https://auction.artron.net/paimai-art20510198,https://image.artron.net/wd/auction//31/art/599/b7328a3f81d90c43e0a3da28c168f742.jpg,40,Vase,Qing,74200,76002,0,1,0,74200.0,4,0.976779287124115,1,V1
Qianlong Qinghua Three Sheep Kaitai Guanyin vase,180,Qing Qianlong,Christie's,"Spring Auction 2003 - Fine Art, Ceramics and Crafts from the Chinese Imperial Court",Spring Auction 2003,07/07/2003,,https://auction.artron.net/paimai-art20510204,https://image.artron.net/wd/auction//31/art/599/a2a0776d2d3a9423bcd78ea1f6550940.jpg,39,Vase,Qing,159000,152004,0,1,0,159000.0,4,0.976779287124115,1,V1
Qianlong Transparent set light blue long-necked vase,182,Qing Qianlong,Christie's,"Spring Auction 2003 - Fine Art, Ceramics and Crafts from the Chinese Imperial Court",Spring Auction 2003,07/07/2003,,https://auction.artron.net/paimai-art20510212,https://image.artron.net/wd/auction//31/art/599/b1da5f53f072b0febc7953b4504308f6.jpg,28,Vase,Qing,132500,152004,0,1,0,132500.0,3,1.06683695189442,2,V2
"In the eighteenth century of the Qing Dynasty, the blue ground set yellow flowers and birds pattern flowers vase pair",183,"Qing Dynasty, 18th century",Christie's,"Spring Auction 2003 - Fine Art, Ceramics and Crafts from the Chinese Imperial Court",Spring Auction 2003,07/07/2003,,https://auction.artron.net/paimai-art20510216,https://image.artron.net/wd/auction//31/art/599/761ae4ce7db6c5bb4dc519ae36d7e817.jpg,22,Vase,Qing,68900,63335,0,1,0,68900.0,3,1.06683695189442,2,V2
Ming Wanli Colorful dragon pattern halberd flower vase,196,Ming Wanli,Christie's,Autumn Auction 2002 - Unique Insight: Important Chinese Art from the Mano Art Museum,Autumn Auction 2002,28/10/2002,,https://auction.artron.net/paimai-art18740034,https://image.artron.net/wd/auction//31/art/484/990773be6f2ac1918285fd1ca789810a.jpg,30,Vase,Ming,2862000,4742546,0,1,0,2862000.0,4,0.228607918263091,4,V4
Early 15th century of the Ming Dynasty Longquan kiln green shaft plum vase,206,Early Ming 15th century,Christie's,Autumn Auction 2002 - Unique Insight: Important Chinese Art from the Mano Art Museum,Autumn Auction 2002,28/10/2002,,https://auction.artron.net/paimai-art18740057,https://image.artron.net/wd/auction//31/art/484/523b549833a32d1d0a7c47cd87c1f123.jpg,39,Vase,Ming,424000,354676,0,1,0,424000.0,4,0.228607918263091,4,V4
Qianlong Qinglong tea glaze ear vase,219,Qing Qianlong,Christie's,Autumn Auction 2002 - Unique Insight: Important Chinese Art from the Mano Art Museum,Autumn Auction 2002,28/10/2002,,https://auction.artron.net/paimai-art18740060,https://image.artron.net/wd/auction//31/art/484/e01ba3b61155493c999753db1a3fb7ed.jpg,34,Vase,Qing,318000,405344,0,1,0,318000.0,4,0.976779287124115,1,V1
"Qingqianlong blue and white folding branches, fruit plum vase",224,Qing Qianlong,Christie's,Autumn Auction 2002 - Fine Chinese Ceramics and Crafts,Autumn Auction 2002,27/10/2002,,https://auction.artron.net/paimai-art18760118,https://image.artron.net/wd/auction//31/art/485/bd7e5785acfc6a46cb7d2f766dac16ac.jpg,32,Vase,Qing,1113000,1477746,0,0,0,1113000.0,4,0.976779287124115,1,V1
Qingdao light blue and white folding flower branches flower stick vase,227,Qing Daoguang,Christie's,Autumn Auction 2002 - Fine Chinese Ceramics and Crafts,Autumn Auction 2002,27/10/2002,,https://auction.artron.net/paimai-art18760120,https://image.artron.net/wd/auction//31/art/485/cf79bc8aac6575b04b988ba59e91a7b4.jpg,31,Vase,Qing,185500,253340,0,0,0,185500.0,4,0.976779287124115,1,V1
"Qing 18th century colorful blooming figure flowers, birds, phoenix tail vase",230,"Qing Dynasty, 18th century",Christie's,Autumn Auction 2002 - Fine Chinese Ceramics and Crafts,Autumn Auction 2002,27/10/2002,,https://auction.artron.net/paimai-art18760145,https://image.artron.net/wd/auction//31/art/485/7436745287eb06299cf89cd2127484e0.jpg,45,Vase,Qing,265000,190005,0,0,0,265000.0,4,0.976779287124115,1,V1
Qingqianlong apple green glaze embossed seawater cloud dragon lantern vase,232,Qing Qianlong,Christie's,Autumn Auction 2002 - Fine Chinese Ceramics and Crafts,Autumn Auction 2002,27/10/2002,,https://auction.artron.net/paimai-art18760132,https://image.artron.net/wd/auction//31/art/485/9b01cf000b2b0b4b693d16158de2c75b.jpg,46,Vase,Qing,2385000,3576546,0,0,0,2385000.0,4,0.976779287124115,1,V1
Qianlong bean green glaze gourd vase,234,Qing Qianlong,Christie's,Autumn Auction 2002 - Fine Chinese Ceramics and Crafts,Autumn Auction 2002,27/10/2002,,https://auction.artron.net/paimai-art18760142,https://image.artron.net/wd/auction//31/art/485/f8a7524f89bf18a3d53d9e2e4f07fb0a.jpg,34,Vase,Qing,212000,126670,0,0,0,212000.0,4,0.976779287124115,1,V1
Qing 18th/19th century Furnace glazed elephant-eared flat vase,235,Qing 18th/19th century,Christie's,Autumn Auction 2002 - Fine Chinese Ceramics and Crafts,Autumn Auction 2002,27/10/2002,,https://auction.artron.net/paimai-art18760138,https://image.artron.net/wd/auction//31/art/485/98527d349ec734343a91b8f2244aed6b.jpg,31,Vase,Qing,74200,69668,0,0,0,74200.0,4,0.976779287124115,1,V1
Qing Kangxi Colorful blossoming flowers and birds stick vase,237,Qing Kangxi,Christie's,Autumn Auction 2002 - Fine Chinese Ceramics and Crafts,Autumn Auction 2002,27/10/2002,,https://auction.artron.net/paimai-art18760146,https://image.artron.net/wd/auction//31/art/485/30b5c4ec07355a3d8d9bacf813556cc5.jpg,46,Vase,Qing,424000,760020,0,0,0,424000.0,4,0.976779287124115,1,V1
Qing Yongzheng imitation official kiln with vase,238,Qing Yongzheng,Christie's,Autumn Auction 2002 - Fine Chinese Ceramics and Crafts,Autumn Auction 2002,27/10/2002,,https://auction.artron.net/paimai-art18760140,https://image.artron.net/wd/auction//31/art/485/41b8da58ab393b15d620839881d4c65b.jpg,20,Vase,Qing,212000,190005,0,0,0,212000.0,3,1.06683695189442,2,V2
Qianlong of the Qing Dynasty imitated the official kiln and skimmed Guanyin vase,239,Qing Qianlong,Christie's,Autumn Auction 2002 - Fine Chinese Ceramics and Crafts,Autumn Auction 2002,27/10/2002,,https://auction.artron.net/paimai-art18760141,https://image.artron.net/wd/auction//31/art/485/cfb1c5317856794a4fb6ec055c39cb21.jpg,21,Vase,Qing,212000,202672,0,0,0,212000.0,3,1.06683695189442,2,V2
Qing Jiaqing turquoise pastel gualipa pattern vase,245,Qing Jiaqing,Christie's,Autumn Auction 2002 - Fine Chinese Ceramics and Crafts,Autumn Auction 2002,27/10/2002,,https://auction.artron.net/paimai-art18760153,https://image.artron.net/wd/auction//31/art/485/868587df3fa45cea99f612198ab8d472.jpg,16,Vase,Qing,742000,1710946,0,0,0,742000.0,2,1.42879948914432,5,V5
Qianlong Peacock green pastel Ruyi Baxiang pattern skimming vase,246,Qing Qianlong,Christie's,Autumn Auction 2002 - Fine Chinese Ceramics and Crafts,Autumn Auction 2002,27/10/2002,,https://auction.artron.net/paimai-art18760155,https://image.artron.net/wd/auction//31/art/485/481cac5eac04502c212b67438f0938a5.jpg,27,Vase,Qing,1855000,44334,0,0,0,1855000.0,3,1.06683695189442,2,V2
Qianlong of the Qing Dynasty Purple Pink Ground Pastel Eight Auspicious Flowers vase A pair,248,Qing Qianlong,Christie's,Autumn Auction 2002 - Fine Chinese Ceramics and Crafts,Autumn Auction 2002,27/10/2002,,https://auction.artron.net/paimai-art18760152,https://image.artron.net/wd/auction//31/art/485/19861a825dfc21cf201b3856c6239ba9.jpg,24,Vase,Qing,689000,633350,0,0,0,689000.0,3,1.06683695189442,2,V2
Qianlong Qingqianlong imitation stone ground open light pastel landscape map with lid lantern vase,256,Qing Qianlong,Christie's,"2002 Spring Sale - Chinese Imperial Court, Chinese Ceramics and Crafts",Spring Auction 2002,29/04/2002,,https://auction.artron.net/paimai-art17110566,https://image.artron.net/wd/auction//31/art/384/637c23310e4b640ed5cbfe1712050cb1.jpg,20,Vase,Qing,3498000,3343346,0,0,0,3498000.0,3,1.06683695189442,2,V2
Qianlong Pastel Nine Peach Five Bat Sky Ball vase,259,Qing Qianlong,Christie's,"2002 Spring Sale - Chinese Imperial Court, Chinese Ceramics and Crafts",Spring Auction 2002,29/04/2002,,https://auction.artron.net/paimai-art17110568,https://image.artron.net/wd/auction//31/art/384/eb0c9dee0462b2be09e0d3099343ee6c.jpg,50,Vase,Qing,1431000,2177346,0,0,0,1431000.0,4,0.976779287124115,1,V1
Qianlong Qinglong peacock green glaze engraved double dragon cloud bat pattern gallbladder vase,264,Qing Qianlong,Christie's,"2002 Spring Sale - Chinese Imperial Court, Chinese Ceramics and Crafts",Spring Auction 2002,29/04/2002,,https://auction.artron.net/paimai-art17110571,https://image.artron.net/wd/auction//31/art/384/f3ee6e925a8ec8a89296aca11c12d9b9.jpg,31,Vase,Qing,1431000,2060746,0,0,0,1431000.0,4,0.976779287124115,1,V1
Qing Jiaqing coral red ground painted golden bat longevity pattern gourd vase,268,Qing Jiaqing,Christie's,"2002 Spring Sale - Chinese Imperial Court, Chinese Ceramics and Crafts",Spring Auction 2002,29/04/2002,,https://auction.artron.net/paimai-art17110574,https://image.artron.net/wd/auction//31/art/384/543f7d48c5fa05f49b46f130094f7466.jpg,29,Vase,Qing,636000,633350,0,0,0,636000.0,3,1.06683695189442,2,V2
Ming Hongwu glaze red four seasons pattern vase,269,Ming Hongwu,Christie's,"2002 Spring Sale - Chinese Imperial Court, Chinese Ceramics and Crafts",Spring Auction 2002,29/04/2002,,https://auction.artron.net/paimai-art17110608,https://image.artron.net/wd/auction//31/art/384/81e77cf701ce817a778cd53a02a784a5.jpg,33,Vase,Ming,424000,380010,0,0,0,424000.0,4,0.228607918263091,4,V4
Qing Yongzheng blue and white folding branches and fruit pattern plum vase,271,Qing Yongzheng,Christie's,"2002 Spring Sale - Chinese Imperial Court, Chinese Ceramics and Crafts",Spring Auction 2002,29/04/2002,,https://auction.artron.net/paimai-art17110631,https://image.artron.net/wd/auction//31/art/384/cbd46520d49841cb5d6e1e9b7b37c45d.jpg,31,Vase,Qing,143100,329342,0,0,0,143100.0,4,0.976779287124115,1,V1
"Qing Kangxi colorful """"empty city plan Cao Cao"""", """"Tongguan meets Ma Chao"""" picture vase",275,Qing Kangxi,Christie's,"2002 Spring Sale - Chinese Imperial Court, Chinese Ceramics and Crafts",Spring Auction 2002,29/04/2002,,https://auction.artron.net/paimai-art17110622,https://image.artron.net/wd/auction//31/art/384/9b115d1a9d6c503d7242803df018f9a7.jpg,47,Vase,Qing,424000,443345,0,0,0,424000.0,4,0.976779287124115,1,V1
Ming Wanli multicolored stone pattern large flowers vase,278,Ming Wanli,Christie's,"2002 Spring Sale - Chinese Imperial Court, Chinese Ceramics and Crafts",Spring Auction 2002,29/04/2002,,https://auction.artron.net/paimai-art17110618,https://image.artron.net/wd/auction//31/art/384/2afb17e238c75a355aa46bd129669922.jpg,68,Vase,Ming,424000,608016,0,0,0,424000.0,4,0.228607918263091,4,V4
Qing Yongzheng imitation Ru kiln pink green glaze vase,279,Qing Yongzheng,Christie's,"2002 Spring Sale - Chinese Imperial Court, Chinese Ceramics and Crafts",Spring Auction 2002,29/04/2002,,https://auction.artron.net/paimai-art17110656,https://image.artron.net/wd/auction//31/art/384/403b31c67d7a19b4490695203a14fa1c.jpg,17,Vase,Qing,636000,430678,0,0,0,636000.0,2,1.42879948914432,5,V5
Qingxianfeng red glazed vase,280,Qing Xianfeng,Christie's,"2002 Spring Sale - Chinese Imperial Court, Chinese Ceramics and Crafts",Spring Auction 2002,29/04/2002,,https://auction.artron.net/paimai-art17110657,https://image.artron.net/wd/auction//31/art/384/c242b166ad6a66a6ebdee505916cfe49.jpg,30,Vase,Qing,74200,69668,0,0,0,74200.0,4,0.976779287124115,1,V1
Qianlong of the Qing Dynasty imitation Ru kiln azure glaze out of the halberd vase,283,Qing Qianlong,Christie's,"2002 Spring Sale - Chinese Imperial Court, Chinese Ceramics and Crafts",Spring Auction 2002,29/04/2002,,https://auction.artron.net/paimai-art17110655,https://image.artron.net/wd/auction//31/art/384/f17035269690100b33173a384b44cc65.jpg,17,Vase,Qing,238500,228006,0,0,0,238500.0,2,1.42879948914432,5,V5
Qing Xuantong pastel butterfly pattern vase,284,Qing dynasty (1644-1911),Christie's,"2002 Spring Sale - Chinese Imperial Court, Chinese Ceramics and Crafts",Spring Auction 2002,29/04/2002,,https://auction.artron.net/paimai-art17110646,https://image.artron.net/wd/auction//31/art/384/31c44b9d9fee9c4c477a1fd7cfe81f7c.jpg,29,Vase,Qing,106000,139337,0,0,0,106000.0,3,1.06683695189442,2,V2
Qing Yongzheng Ji blue glazed vase,285,Qing Yongzheng,Christie's,"2002 Spring Sale - Chinese Imperial Court, Chinese Ceramics and Crafts",Spring Auction 2002,29/04/2002,,https://auction.artron.net/paimai-art17110651,https://image.artron.net/wd/auction//31/art/384/f5d08dc0f3f817094c2706b1836026d7.jpg,29,Vase,Qing,333900,506680,0,0,0,333900.0,3,1.06683695189442,2,V2
Qianlong Qinghua peach willow competing for spring bird vase,287,Qing Qianlong,Christie's,"2002 Spring Sale - Chinese Imperial Court, Chinese Ceramics and Crafts",Spring Auction 2002,29/04/2002,,https://auction.artron.net/paimai-art17110640,https://image.artron.net/wd/auction//31/art/384/eb93ec74659ef8faf9466123cdd27950.jpg,42,Vase,Qing,132500,101336,0,0,0,132500.0,4,0.976779287124115,1,V1
Qing 19th century Doucai lotus bat pattern double dragon ear vase,288,Qing Nineteenth Century,Christie's,"2002 Spring Sale - Chinese Imperial Court, Chinese Ceramics and Crafts",Spring Auction 2002,29/04/2002,,https://auction.artron.net/paimai-art17110649,https://image.artron.net/wd/auction//31/art/384/ea8cfcd2b959e81887ac42965ed8036b.jpg,44,Vase,Qing,212000,228006,0,0,0,212000.0,4,0.976779287124115,1,V1
Qianlong imitation brother kiln glaze double ruyi ear vase,290,Qing Qianlong,Christie's,"2002 Spring Sale - Chinese Imperial Court, Chinese Ceramics and Crafts",Spring Auction 2002,29/04/2002,,https://auction.artron.net/paimai-art17110664,https://image.artron.net/wd/auction//31/art/384/70e18aaeaaa88dbdb4ddd2871e3e4926.jpg,26,Vase,Qing,143100,253340,0,0,0,143100.0,3,1.06683695189442,2,V2
Qianlong Qinglong tea glazed double animal ear vase,291,Qing Qianlong,Christie's,"2002 Spring Sale - Chinese Imperial Court, Chinese Ceramics and Crafts",Spring Auction 2002,29/04/2002,,https://auction.artron.net/paimai-art17110666,https://image.artron.net/wd/auction//31/art/384/e95eba98b100948fd879c0c42827f3a2.jpg,51,Vase,Qing,185500,253340,0,0,0,185500.0,4,0.976779287124115,1,V1
Qianlong sauce glaze gold opening stone pattern vase,292,Qing Qianlong,Christie's,"2002 Spring Sale - Chinese Imperial Court, Chinese Ceramics and Crafts",Spring Auction 2002,29/04/2002,,https://auction.artron.net/paimai-art17110667,https://image.artron.net/wd/auction//31/art/384/f95b221623b4b3d720abf23aef9b294b.jpg,13,Vase,Qing,53000,50668,0,0,0,53000.0,1,1.28591954022989,6,V6
Qianlong imitation Ge kiln glazed vase,293,Qing Qianlong,Christie's,"2002 Spring Sale - Chinese Imperial Court, Chinese Ceramics and Crafts",Spring Auction 2002,29/04/2002,,https://auction.artron.net/paimai-art17110665,https://image.artron.net/wd/auction//31/art/384/b0d9606949064d166dc973f5c88a55a4.jpg,29,Vase,Qing,95400,177338,0,0,0,95400.0,3,1.06683695189442,2,V2
Qianlong tea glazed melon prismatic ear vase,296,Qing Qianlong,Christie's,"2002 Spring Sale - Chinese Imperial Court, Chinese Ceramics and Crafts",Spring Auction 2002,29/04/2002,,https://auction.artron.net/paimai-art17110670,https://image.artron.net/wd/auction//31/art/384/9fb2fbce0f8f3102fb55504b69be3c0b.jpg,41,Vase,Qing,185500,215339,0,0,0,185500.0,4,0.976779287124115,1,V1
Qing Kangxi Colorful Arhat play wolf figure stick vase,299,Qing Kangxi,Christie's,Autumn Auction 2001 - Important Chinese Crafts,Autumn Auction 2001,29/10/2001,Finely enamelled and gilt around the body with two gold-skinned demonic barbarians闁挎稑顔坣e outfitted in full armour and holding a horn闁挎稑顓緄s attendant holding a sword and perched on large rock闁挎稑鐣皁th attempting to tease a golden wolf chained to a column decorated with three large blossoms with scrolling tendrils and surmounted by an Islamic-like dome闁挎稑顔唀xt to a pine tree with the moon overhead闁挎稑顔揾e neck decorated with a sprig of lingzhi and bamboo,https://auction.artron.net/paimai-art16470796,https://image.artron.net/wd/auction//31/art/275/fbf8e60346810b13a508512c90cb8e98.jpg,45,Vase,Qing,424000,435925,0,0,0,424000.0,4,0.976779287124115,1,V1
Ming Yongle blue and white lotus pattern vase,300,Ming Yongle,Christie's,Autumn Auction 2001 - Important Chinese Crafts,Autumn Auction 2001,29/10/2001,The vase is superbly potted with rounded shoulders supporting a waisted neck and tapering down to a broad base闁挎稑鐣秞quisitely painted in soft inky-blue cobalt with lotus at various stages of bloom闁挎稑鐣皁rne on freely scrolling stems with trefoil leaves intertwined with millet branches闁挎稑鐣癳low a classic scroll band around the shoulder and a frieze of six detached lotus sprigs encircling the base闁挎稑鐣甽l within double-line borders闁挎稑鐣篿ne line below glaze,https://auction.artron.net/paimai-art16470783,https://image.artron.net/wd/auction//31/art/275/6a12245259cd4005e17a496a624d0969.jpg,25,Vase,Ming,848000,1446900,0,0,0,848000.0,3,1.02873563218391,3,V3
Qianlong Qinglong Tea leaves are glazed vase,304,Qing Qianlong,Christie's,Autumn Auction 2001 - Important Chinese Crafts,Autumn Auction 2001,29/10/2001,Of archaic bronze hu form闁挎稑顔揾e circular vase is well potted with full rounded sides rising from a slightly splayed foot to sharply angled shoulders闁挎稑顔揾e incurving neck moulded with a single rib and set with a pair of tubular handles below the slightly flared mouthrim闁挎稑鐣畃plied overall with a lustrous yellowish olive-green glaze suffused with darker speckles,https://auction.artron.net/paimai-art16470800,https://image.artron.net/wd/auction//31/art/275/f8d2d726f084bad8bf633478e38da1a2.jpg,52,Vase,Qing,333900,249100,0,0,0,333900.0,4,0.976779287124115,1,V1
