Name,unique_id,Year of Work,Auction House,Session,Meeting,Sale of,Description,Product URL,Image URL,Size,Category,Period,Estimate RMB,Sold For RMB,China,T,China*T,Estimate,Size_c,weights,subclass,Stratum
Qing Jiaqing Pastel Tangled Treasure Pattern Bowl (pair),1510,Qing Jiaqing,China Guardian,"Autumn Auction 2001 - Porcelain, Jade, Arts and Crafts, Furniture",China Guardian Autumn Auction 2001,04/11/2001,"The heart of the bowl is painted in alum-red with five bats for longevity, the outer rim with a ruyi cloud-head motif, and the shin with a lotus petal motif, the motifs in famille-rose on a pink ground with entwined flowers and catfish, the colours bright and auspicious.",https://auction.artron.net/paimai-art15890133,https://image.artron.net/wd/auction//5/art/238/a26981ff524b4ced46b90664984bae73.jpg,18,Bowl,Qing,135000,132000,1,0,0,135000.0,2,1.0,3,B3
Qingdao Guang Blue and white Fushou dragon pattern bowl,1523,Qing Daoguang,China Guardian,"Autumn Auction 2001 - Porcelain, Jade, Arts and Crafts, Furniture",China Guardian Autumn Auction 2001,04/11/2001,"The bowl is painted with a cloud and dragon motif in blue and white, with the auspicious characters 'fu' and 'shou' written in blue and white within the cloud motif, the decoration auspicious and skilfully painted.",https://auction.artron.net/paimai-art15890167,https://image.artron.net/wd/auction//5/art/238/6a5172d7820feef0ade60f9afe9b45b7.jpg,13,Bowl,Qing,15000,11000,1,0,0,15000.0,1,1.0,1,B1
Qing Daoguang pastel three sheep kaitutu bowl,1540,Qing Daoguang,China Guardian,"Autumn Auction 2001 - Porcelain, Jade, Arts and Crafts, Furniture",China Guardian Autumn Auction 2001,04/11/2001,"The bowl is in the form of a bucket, the exterior painted in famille-rose with three sheep in a formalized floral design, the layout of which is rigorous and auspicious. The footrim is slightly bruised.",https://auction.artron.net/paimai-art15890212,https://image.artron.net/wd/auction//5/art/238/6254e803eb500a0084551adebe1c1dc5.jpg,14,Bowl,Qing,60000,55000,1,0,0,60000.0,2,1.0,3,B3
Qing Daoguang pastel baby play picture bowl (pair),1541,Qing Daoguang,China Guardian,"Autumn Auction 2001 - Porcelain, Jade, Arts and Crafts, Furniture",China Guardian Autumn Auction 2001,04/11/2001,"The outer wall is painted in pastel with a magpie on a branch, a bamboo standing up, and a child lighting a firecracker, taking the meaning of the bamboo as a sign of peace.",https://auction.artron.net/paimai-art15890207,https://image.artron.net/wd/auction//5/art/238/fd8a7f12e18d67daa6ba9b46fe501959.jpg,14,Bowl,Qing,60000,55000,1,0,0,60000.0,2,1.0,3,B3
Qing Guangxu coral red light pastel peony pattern bowl,1544,Qing Guangxu,China Guardian,"Autumn Auction 2001 - Porcelain, Jade, Arts and Crafts, Furniture",China Guardian Autumn Auction 2001,04/11/2001,"The straight mouth with rounded belly and footrim. The outer wall is decorated with a floral design on a coral-red ground, the interior painted with a folding peony design in vivid colours and smoothly painted.",https://auction.artron.net/paimai-art15890217,https://image.artron.net/wd/auction//5/art/238/b436a728bccb02ad1401d89756e3427e.jpg,11,Bowl,Qing,15000,22000,1,0,0,15000.0,1,1.0,1,B1
Qing Daoguang light pastel floral pattern bowl (pair),1545,Qing Daoguang,China Guardian,"Autumn Auction 2001 - Porcelain, Jade, Arts and Crafts, Furniture",China Guardian Autumn Auction 2001,04/11/2001,"The bowl is of regular form, with a plain white interior and painted on the exterior with a floral design of moonflowers and chrysanthemums in pastel colours, the composition sparse and brightly coloured.",https://auction.artron.net/paimai-art15890211,https://image.artron.net/wd/auction//5/art/238/825a8f0280a0993a5f9ec6632b3717fe.jpg,15,Bowl,Qing,70000,66000,1,0,0,70000.0,2,1.0,3,B3
Qing Daoguang pastel years cold three friends picture bowl,1546,Qing Daoguang,China Guardian,"Autumn Auction 2001 - Porcelain, Jade, Arts and Crafts, Furniture",China Guardian Autumn Auction 2001,04/11/2001,"The bowl is of generous form, the outer wall painted in pastel with a picture of the three friends of the year, pine, bamboo and plum, in a sparse and colourful layout.",https://auction.artron.net/paimai-art15890214,https://image.artron.net/wd/auction//5/art/238/a1e3ace9d5510a138ef9349fc2045b10.jpg,18,Bowl,Qing,20000,16500,1,0,0,20000.0,2,1.0,3,B3
Qianlong Qinglong pastel plastic fruit high,1,Qing Kangxi,Sotheby's,2001 Autumn Auction - Chinese porcelain and handicrafts,Autumn Auction 2001,29/10/2001,,https://auction.artron.net/paimai-art16140013,https://image.artron.net/wd/auction//34/art/285/9afbce19d36ae24343c3fe99a09dcddb.jpg,15,Dish,Qing,143100,82680,0,0,0,143100.0,2,2.75975609756097,1,D1
" Qing Yongzheng Doucai Tuanhua """"Shouji"""" pattern dish",10,Qing Yongzheng,Sotheby's,2001 Autumn Auction - Chinese porcelain and handicrafts,Autumn Auction 2001,29/10/2001,,https://auction.artron.net/paimai-art16140020,https://image.artron.net/wd/auction//34/art/285/d57fdf4644649301b4350f7d6a2fb130.jpg,20,Dish,Qing,238500,249895,0,0,0,238500.0,3,0.854634146341463,2,D2
Ming Yongle blue and white inner peony flower fruit outer Ganoderma lucidum ribbed large dish,11,Ming Yongle,Sotheby's,2001 Autumn Auction - Chinese porcelain and handicrafts,Autumn Auction 2001,29/10/2001,,https://auction.artron.net/paimai-art16140028,https://image.artron.net/wd/auction//34/art/285/aad4ed3437d420f563f18fa091f8bebb.jpg,44,Dish,Ming,742000,591215,0,0,0,742000.0,4,0.23739837398374,3,D3
Ming Xuande blue and white lotus pattern dish,14,Ming Xuande,Sotheby's,2001 Autumn Auction - Chinese porcelain and handicrafts,Autumn Auction 2001,29/10/2001,,https://auction.artron.net/paimai-art16140032,https://image.artron.net/wd/auction//34/art/285/76b88675480a93c28ff2eab9c97f6980.jpg,17,Dish,Ming,636000,554645,0,0,0,636000.0,2,0.222560975609756,4,D4
Ming Jiajing mackerel algae dish,15,Ming Jiajing,Sotheby's,2001 Autumn Auction - Chinese porcelain and handicrafts,Autumn Auction 2001,29/10/2001,,https://auction.artron.net/paimai-art16140038,https://image.artron.net/wd/auction//34/art/285/c65c62d030b5f6d39c8d9cbb102b37ec.jpg,15,Dish,Ming,190800,274275,0,0,0,190800.0,2,0.222560975609756,4,D4
Ming Jiajing Blue land blue and white dragon pattern dish,16,Ming Jiajing,Sotheby's,2001 Autumn Auction - Chinese porcelain and handicrafts,Autumn Auction 2001,29/10/2001,,https://auction.artron.net/paimai-art16140040,https://image.artron.net/wd/auction//34/art/285/72adf87fb3132edd2968c904118b7ff2.jpg,22,Dish,Ming,212000,225515,0,0,0,212000.0,3,0.142439024390244,5,D5
Ming Yongle sweet white glaze floral ribbed dish,19,Ming Yongle,Sotheby's,2001 Autumn Auction - Chinese porcelain and handicrafts,Autumn Auction 2001,29/10/2001,,https://auction.artron.net/paimai-art16140059,https://image.artron.net/wd/auction//34/art/285/26b3e2080aac826117350fe1f1ddc54a.jpg,20,Dish,Ming,583000,615595,0,0,0,583000.0,3,0.142439024390244,5,D5
" Qing Yongzheng pastel over the wall branch """"Fu Shou"""" pattern dish",32,Qing Yongzheng,Sotheby's,2001 Autumn Auction - Chinese porcelain and handicrafts,Autumn Auction 2001,29/10/2001,,https://auction.artron.net/paimai-art16140096,https://image.artron.net/wd/auction//34/art/285/0bdbe9c238771622d021e2c1032d0987.jpg,21,Dish,Qing,2915000,3079035,0,0,0,2915000.0,3,0.854634146341463,2,D2
Qing Yongzheng Carmine Yellow Ju dish,34,Qing Yongzheng,Sotheby's,2001 Autumn Auction - Chinese porcelain and handicrafts,Autumn Auction 2001,29/10/2001,,https://auction.artron.net/paimai-art16140091,https://image.artron.net/wd/auction//34/art/285/9378763f694854ef652961f1a8037f99.jpg,11,Dish,Qing,371000,591215,0,0,0,371000.0,1,1.92292682926829,6,D6
" Qing Yongzheng pastel over the wall branch """"Qunfang birthday celebration"""" round large dish",38,Qing Yongzheng,Sotheby's,2001 Autumn Auction - Chinese porcelain and handicrafts,Autumn Auction 2001,29/10/2001,,https://auction.artron.net/paimai-art16140102,https://image.artron.net/wd/auction//34/art/285/6995f09d80a82e9d11e51849b18a14e1.jpg,51,Dish,Qing,954000,2204535,0,0,0,954000.0,4,1.1869918699187,7,D7
Qing Yongzheng Lemon yellow color dish,56,Qing Yongzheng,Sotheby's,2001 Autumn Auction - Chinese porcelain and handicrafts,Autumn Auction 2001,29/10/2001,,https://auction.artron.net/paimai-art16140125,https://image.artron.net/wd/auction//34/art/285/2d863e6422bedc3df6c2c1bdfb4ffc78.jpg,10,Dish,Qing,95400,101760,0,0,0,95400.0,1,1.92292682926829,6,D6
Qianlong Green glazed dish,59,Qianlong of the Qing Dynasty,Sotheby's,2001 Autumn Auction - Chinese porcelain and handicrafts,Autumn Auction 2001,29/10/2001,,https://auction.artron.net/paimai-art16140140,https://image.artron.net/wd/auction//34/art/285/e5b382cd4dc8027c18cec49a83fc88d9.jpg,14,Dish,Qing,26500,33072,0,0,0,26500.0,2,2.75975609756097,1,D1
Late Ming Dynasty Zhangzhou kiln painted Arabic dish,66,Late Ming,Christie's,Important Chinese Porcelain Crafts (I & II),2003 Autumn Art Auction,27/10/2003,,https://auction.artron.net/paimai-art23170004,https://image.artron.net/wd/auction//31/art/705/3c9d0dd0f52942f1179f356ff5d803cd.jpg,38,Dish,Ming,37100,35468,0,1,0,37100.0,4,0.23739837398374,3,D3
"In the 14th and 15th centuries of the Ming Dynasty, Longquan kiln green glaze carved brocade pattern diamond flower mouth large dish",67,Ming 14th and 15th centuries,Christie's,Important Chinese Porcelain Crafts (I & II),2003 Autumn Art Auction,27/10/2003,,https://auction.artron.net/paimai-art23170012,https://image.artron.net/wd/auction//31/art/705/bc3f5590479a1fb7fa636330c0d2f1a9.jpg,42,Dish,Ming,63600,164671,0,1,0,63600.0,4,0.23739837398374,3,D3
Ming Wanli Colorful characters five birthday dish,70,Ming Wanli,Christie's,Important Chinese Porcelain Crafts (I & II),2003 Autumn Art Auction,27/10/2003,Signed in regular script with two circles and two lines in six characters,https://auction.artron.net/paimai-art23170014,https://image.artron.net/wd/auction//31/art/705/cba4fca26d3737a72406e4814c7f84d0.jpg,14,Dish,Ming,53000,82336,0,1,0,53000.0,2,0.222560975609756,4,D4
Fifteenth century Ming Dynasty blue-and-white lotus pattern dish,75,Ming 15th century,Christie's,Important Chinese Porcelain Crafts (I & II),2003 Autumn Art Auction,27/10/2003,,https://auction.artron.net/paimai-art23170023,https://image.artron.net/wd/auction//31/art/705/b3259d8066abf589e608f909a013c016.jpg,28,Dish,Ming,424000,380010,0,1,0,424000.0,3,0.142439024390244,5,D5
Ming Jiajing Blue land left white five cranes holding the birthday pattern dish,78,Ming Jiajing,Christie's,Important Chinese Porcelain Crafts (I & II),2003 Autumn Art Auction,27/10/2003,Six-character regular script mark,https://auction.artron.net/paimai-art23170018,https://image.artron.net/wd/auction//31/art/705/c57a8af1bf8978e05101fe6ea3627e50.jpg,33,Dish,Ming,371000,481346,0,1,0,371000.0,4,0.23739837398374,3,D3
Ming Yongle Blue and white dark dragon cloud dragon play bead pattern dish,85,Ming Yongle,Christie's,Important Chinese Porcelain Crafts (I & II),2003 Autumn Art Auction,27/10/2003,,https://auction.artron.net/paimai-art23170025,https://image.artron.net/wd/auction//31/art/705/004b0e08fa2c52a207dfc422f6d7342e.jpg,18,Dish,Ming,2014000,3629175,0,1,0,2014000.0,2,0.222560975609756,4,D4
Qing Kangxi Eggplant skin purple glaze engraved three dragon play bead dish,92,Qing Kangxi,Christie's,Important Chinese Porcelain Crafts (I & II),2003 Autumn Art Auction,27/10/2003,Signed in regular script with two circles and two lines in six characters,https://auction.artron.net/paimai-art23170032,https://image.artron.net/wd/auction//31/art/705/03faa45ae038f3decbbce287769ff296.jpg,25,Dish,Qing,143100,126670,0,1,0,143100.0,3,0.854634146341463,2,D2
"Qing Yongzheng pastel over the wall branches, flowers, bee pattern large dish",93,Qing Yongzheng,Christie's,Important Chinese Porcelain Crafts (I & II),2003 Autumn Art Auction,27/10/2003,Signed in regular script with two circles and two lines in six characters,https://auction.artron.net/paimai-art23170061,https://image.artron.net/wd/auction//31/art/705/8f9e9fb246dd02d83b30f27472b8bd50.jpg,54,Dish,Qing,636000,823355,0,1,0,636000.0,4,1.1869918699187,7,D7
Qing Yongzheng pastel eight peach five bat dish,97,Qing Yongzheng,Christie's,Important Chinese Porcelain Crafts (I & II),2003 Autumn Art Auction,27/10/2003,Signed in regular script with six characters on each side of the frame,https://auction.artron.net/paimai-art23170064,https://image.artron.net/wd/auction//31/art/705/0048d797d26fc63dc30d17c161fa8939.jpg,21,Dish,Qing,6360000,9802615,0,1,0,6360000.0,3,0.854634146341463,2,D2
Qing Yongzheng Doucai peach crane pattern dish,100,Qing Yongzheng,Christie's,Important Chinese Porcelain Crafts (I & II),2003 Autumn Art Auction,27/10/2003,Signed in regular script with two circles and two lines in six characters,https://auction.artron.net/paimai-art23170057,https://image.artron.net/wd/auction//31/art/705/8628e9b242814bff18f7f5d0a3a833f6.jpg,18,Dish,Qing,1325000,1076695,0,1,0,1325000.0,2,2.75975609756097,1,D1
Qianlong Blue and white yellow glazed dragon play beaded dish,103,Qing Qianlong,Christie's,Important Chinese Porcelain Crafts (I & II),2003 Autumn Art Auction,27/10/2003,Six-character seal script mark,https://auction.artron.net/paimai-art23170080,https://image.artron.net/wd/auction//31/art/705/ffc37bad2410de1f620841c48bbcec68.jpg,26,Dish,Qing,106000,114003,0,1,0,106000.0,3,0.854634146341463,2,D2
Qing Yongzheng Lemon yellow glazed lotus-shaped dish,125,Qing Yongzheng,Christie's,"Spring Auction 2003 - Fine Art, Ceramics and Crafts from the Chinese Imperial Court",Spring Auction 2003,07/07/2003,,https://auction.artron.net/paimai-art20510080,https://image.artron.net/wd/auction//31/art/599/2c46fd474bff211d04344028bf7cfa0d.jpg,29,Dish,Qing,1166000,1373495,0,1,0,1166000.0,3,0.854634146341463,2,D2
Ming Yongle Blue and white silk bird lychee pattern large dish,132,Ming Yongle,Christie's,"Spring Auction 2003 - Fine Art, Ceramics and Crafts from the Chinese Imperial Court",Spring Auction 2003,07/07/2003,,https://auction.artron.net/paimai-art20510143,https://image.artron.net/wd/auction//31/art/599/bae06de6a7d54b958b878097bc1cd5ad.jpg,60,Dish,Ming,4240000,9802615,0,1,0,4240000.0,4,0.23739837398374,3,D3
Ming Yongle Sweet white glazed dark flower phoenix pattern dish,143,Ming Yongle,Christie's,"Spring Auction 2003 - Fine Art, Ceramics and Crafts from the Chinese Imperial Court",Spring Auction 2003,07/07/2003,,https://auction.artron.net/paimai-art20510147,https://image.artron.net/wd/auction//31/art/599/1a1c2eb470e95fa177f2c7d5f1df2ec6.jpg,19,Dish,Ming,371000,823355,0,1,0,371000.0,3,0.142439024390244,5,D5
Ming Yongle Blue and white tangle flowers rhombus mouth dish,147,Ming Yongle,Christie's,"Spring Auction 2003 - Fine Art, Ceramics and Crafts from the Chinese Imperial Court",Spring Auction 2003,07/07/2003,,https://auction.artron.net/paimai-art20510150,https://image.artron.net/wd/auction//31/art/599/7bd7eac519c24b51057d317cdee402bf.jpg,34,Dish,Ming,212000,304008,0,1,0,212000.0,4,0.23739837398374,3,D3
Qing Kangxi Doucai Yunlong play beaded dish,149,Qing Kangxi,Christie's,"Spring Auction 2003 - Fine Art, Ceramics and Crafts from the Chinese Imperial Court",Spring Auction 2003,07/07/2003,,https://auction.artron.net/paimai-art20510165,https://image.artron.net/wd/auction//31/art/599/13a0fabed098bde85c6845adf288d476.jpg,21,Dish,Qing,238500,190005,0,1,0,238500.0,3,0.854634146341463,2,D2
Ming Xuande Ji red glaze dark dragon pattern dish,155,Ming Xuande,Christie's,"Spring Auction 2003 - Fine Art, Ceramics and Crafts from the Chinese Imperial Court",Spring Auction 2003,07/07/2003,,https://auction.artron.net/paimai-art20510151,https://image.artron.net/wd/auction//31/art/599/37f424627fdd22566e1e4d99192253c3.jpg,18,Dish,Ming,530000,506680,0,1,0,530000.0,2,0.222560975609756,4,D4
Ming Wanli blue lotus petal-shaped dish,185,Ming Wanli,Christie's,Autumn Auction 2002 - Unique Insight: Important Chinese Art from the Mano Art Museum,Autumn Auction 2002,28/10/2002,,https://auction.artron.net/paimai-art18740029,https://image.artron.net/wd/auction//31/art/484/43b62c55e8b64bca3a0da08ba5dd4543.jpg,19,Dish,Ming,212000,228006,0,1,0,212000.0,3,0.142439024390244,5,D5
Ming Longqing Colorful Double Dragon Play Bead dish,186,Ming Longqing,Christie's,Autumn Auction 2002 - Unique Insight: Important Chinese Art from the Mano Art Museum,Autumn Auction 2002,28/10/2002,,https://auction.artron.net/paimai-art18740038,https://image.artron.net/wd/auction//31/art/484/ef74ca55efb569a94a14be64c4653e4f.jpg,33,Dish,Ming,159000,190005,0,1,0,159000.0,4,0.23739837398374,3,D3
Ming Hongwu glaze red floral pattern ribbed tray and Japanese Kawase Takeharu glaze red dish,187,Ming Hongwu,Christie's,Autumn Auction 2002 - Unique Insight: Important Chinese Art from the Mano Art Museum,Autumn Auction 2002,28/10/2002,,https://auction.artron.net/paimai-art18740028,https://image.artron.net/wd/auction//31/art/484/88ed95dd13451c110ad9e322534499cf.jpg,20,Dish,Ming,84800,253340,0,1,0,84800.0,3,0.142439024390244,5,D5
Ming 14th/15th century imitation Jun kiln grape purple glaze dish,188,Ming 14th/15th century,Christie's,Autumn Auction 2002 - Unique Insight: Important Chinese Art from the Mano Art Museum,Autumn Auction 2002,28/10/2002,,https://auction.artron.net/paimai-art18740023,https://image.artron.net/wd/auction//31/art/484/1929c114f527b72fdafdc35a4d6de33b.jpg,16,Dish,Ming,84800,177338,0,1,0,84800.0,2,0.222560975609756,4,D4
Ming Zhengde Qingdi blue and white folding branches and fruit dish,189,Ming Zhengde,Christie's,Autumn Auction 2002 - Unique Insight: Important Chinese Art from the Mano Art Museum,Autumn Auction 2002,28/10/2002,,https://auction.artron.net/paimai-art18740030,https://image.artron.net/wd/auction//31/art/484/520580073547536a3fda7b597da00e89.jpg,30,Dish,Ming,2120000,1477746,0,1,0,2120000.0,4,0.23739837398374,3,D3
Ming Hongwu glaze red chrysanthemum pattern ribbed large dish,191,Ming Hongwu,Christie's,Autumn Auction 2002 - Unique Insight: Important Chinese Art from the Mano Art Museum,Autumn Auction 2002,28/10/2002,,https://auction.artron.net/paimai-art18740025,https://image.artron.net/wd/auction//31/art/484/a665d2b53dc85f9bec353ccb491d391f.jpg,45,Dish,Ming,5300000,8823546,0,1,0,5300000.0,4,0.23739837398374,3,D3
Ming Yongle blue and white grape pattern large dish,192,Ming Yongle,Christie's,Autumn Auction 2002 - Unique Insight: Important Chinese Art from the Mano Art Museum,Autumn Auction 2002,28/10/2002,,https://auction.artron.net/paimai-art18740027,https://image.artron.net/wd/auction//31/art/484/ba9ff13013099b62b063d8aea0e38056.jpg,38,Dish,Ming,742000,1011346,0,1,0,742000.0,4,0.23739837398374,3,D3
Qing Kangxi multicolored lotus kingfisher pattern dish,199,Qing Kangxi,Christie's,Autumn Auction 2002 - Unique Insight: Important Chinese Art from the Mano Art Museum,Autumn Auction 2002,28/10/2002,,https://auction.artron.net/paimai-art18740054,https://image.artron.net/wd/auction//31/art/484/a3580b5700451b685b86d924773c0f48.jpg,25,Dish,Qing,106000,329342,0,1,0,106000.0,3,0.854634146341463,2,D2
Ming 16th century painted double dragon wearing pattern dish,205,Ming 16th century,Christie's,Autumn Auction 2002 - Unique Insight: Important Chinese Art from the Mano Art Museum,Autumn Auction 2002,28/10/2002,,https://auction.artron.net/paimai-art18740050,https://image.artron.net/wd/auction//31/art/484/13432efe91cc474271c0e10e8df262a0.jpg,31,Dish,Ming,53000,40534,0,1,0,53000.0,4,0.23739837398374,3,D3
Qianlong imitation lacquered glaze depicted gold imperial inscription chrysanthemum petal dish,213,Qing Qianlong,Christie's,Autumn Auction 2002 - Fine Chinese Ceramics and Crafts,Autumn Auction 2002,27/10/2002,,https://auction.artron.net/paimai-art18760024,https://image.artron.net/wd/auction//31/art/485/3ea5beb1e8475bc7d21ade929bbdec53.jpg,10,Dish,Qing,132500,190005,0,0,0,132500.0,1,1.92292682926829,6,D6
Qing Yongzheng enamel inscription poem over the wall plum bamboo pattern dish,214,Qing Yongzheng,Christie's,Autumn Auction 2002 - Fine Chinese Ceramics and Crafts,Autumn Auction 2002,27/10/2002,,https://auction.artron.net/paimai-art18760030,https://image.artron.net/wd/auction//31/art/485/23e05f2d94c18a634163a300065931ac.jpg,17,Dish,Qing,18550000,34475546,0,0,0,18550000.0,2,2.75975609756097,1,D1
Qingqianlong blue and white years cold three friends pattern dish a pair,223,Qing Qianlong,Christie's,Autumn Auction 2002 - Fine Chinese Ceramics and Crafts,Autumn Auction 2002,27/10/2002,,https://auction.artron.net/paimai-art18760119,https://image.artron.net/wd/auction//31/art/485/e6584a3319f267edfd9643be390e03e2.jpg,18,Dish,Qing,132500,190005,0,0,0,132500.0,2,2.75975609756097,1,D1
Qingyongzheng blue and white peony butterfly stone patterned dish,225,Qing Yongzheng,Christie's,Autumn Auction 2002 - Fine Chinese Ceramics and Crafts,Autumn Auction 2002,27/10/2002,,https://auction.artron.net/paimai-art18760116,https://image.artron.net/wd/auction//31/art/485/e85ca2ed59deecece807e6b7484e62fe.jpg,21,Dish,Qing,238500,253340,0,0,0,238500.0,3,0.854634146341463,2,D2
Qing Shunzhi blue and white Rui animal pattern dish a pair,226,Qing Shunzhi,Christie's,Autumn Auction 2002 - Fine Chinese Ceramics and Crafts,Autumn Auction 2002,27/10/2002,,https://auction.artron.net/paimai-art18760115,https://image.artron.net/wd/auction//31/art/485/04697e61bef8e9614427e48338a09548.jpg,15,Dish,Qing,74200,76002,0,0,0,74200.0,2,2.75975609756097,1,D1
Qing Yongzheng yellow and green glaze dish,231,Qing Yongzheng,Christie's,Autumn Auction 2002 - Fine Chinese Ceramics and Crafts,Autumn Auction 2002,27/10/2002,,https://auction.artron.net/paimai-art18760131,https://image.artron.net/wd/auction//31/art/485/0c66a85dc18f250fae944d165f5b93ff.jpg,13,Dish,Qing,848000,886690,0,0,0,848000.0,1,1.92292682926829,6,D6
Qingyongzheng pink green glazed chrysanthemum petal dish,233,Qing Yongzheng,Christie's,Autumn Auction 2002 - Fine Chinese Ceramics and Crafts,Autumn Auction 2002,27/10/2002,,https://auction.artron.net/paimai-art18760129,https://image.artron.net/wd/auction//31/art/485/f6f3c5c698712456d23b029fbcd9fb27.jpg,18,Dish,Qing,530000,886690,0,0,0,530000.0,2,2.75975609756097,1,D1
"Qing Yongzheng Alum red glaze engraved """"Shou"""" character bat pattern dish",242,Qing Yongzheng,Christie's,Autumn Auction 2002 - Fine Chinese Ceramics and Crafts,Autumn Auction 2002,27/10/2002,,https://auction.artron.net/paimai-art18760150,https://image.artron.net/wd/auction//31/art/485/6b029599c3bbe0695823a9d88142a168.jpg,17,Dish,Qing,143100,152004,0,0,0,143100.0,2,2.75975609756097,1,D1
Ming Wanli colorful birthday chart dish,244,Ming Wanli,Christie's,Autumn Auction 2002 - Fine Chinese Ceramics and Crafts,Autumn Auction 2002,27/10/2002,,https://auction.artron.net/paimai-art18760157,https://image.artron.net/wd/auction//31/art/485/93e30c83828709574f0482e0030cc255.jpg,18,Dish,Ming,53000,114003,0,0,0,53000.0,2,0.222560975609756,4,D4
Qing Yongzheng pastel eight peach five bat pattern dish,249,Qing Yongzheng,Christie's,Autumn Auction 2002 - Fine Chinese Ceramics and Crafts,Autumn Auction 2002,27/10/2002,,https://auction.artron.net/paimai-art18760148,https://image.artron.net/wd/auction//31/art/485/26f334937ff75dc85c44db8de3ca2b23.jpg,21,Dish,Qing,2120000,2177346,0,0,0,2120000.0,3,0.854634146341463,2,D2
Ming Xuande Blue and white dark flower lotus pond fish algae pattern dish,250,Ming Xuande,Christie's,"2002 Spring Sale - Chinese Imperial Court, Chinese Ceramics and Crafts",Spring Auction 2002,29/04/2002,,https://auction.artron.net/paimai-art17110558,https://image.artron.net/wd/auction//31/art/384/248eef1df66feaaa3b2ac76f60b9ec9a.jpg,21,Dish,Ming,742000,1186246,0,0,0,742000.0,3,0.142439024390244,5,D5
"Qing Kangxi Colorful flowers, fruits, birds, and birds dish",254,Qing Kangxi,Christie's,"2002 Spring Sale - Chinese Imperial Court, Chinese Ceramics and Crafts",Spring Auction 2002,29/04/2002,,https://auction.artron.net/paimai-art17110554,https://image.artron.net/wd/auction//31/art/384/7c0b48aea3317252a2055ffb981694b9.jpg,25,Dish,Qing,265000,608016,0,0,0,265000.0,3,0.854634146341463,2,D2
"Qing Kangxi Colorful flowers, fruits, grasses, insects and dish",258,Qing Kangxi,Christie's,"2002 Spring Sale - Chinese Imperial Court, Chinese Ceramics and Crafts",Spring Auction 2002,29/04/2002,,https://auction.artron.net/paimai-art17110553,https://image.artron.net/wd/auction//31/art/384/d803d36656cff7f4190c7d905b0ebee2.jpg,25,Dish,Qing,265000,304008,0,0,0,265000.0,3,0.854634146341463,2,D2
Qing Kangxi Doucai Flower Eight Auspicious Pattern dish (Pair),298,Qing Kangxi,Christie's,Autumn Auction 2001 - Important Chinese Crafts,Autumn Auction 2001,29/10/2001,Each shallow bowl is enamelled in brilliant tones and enhanced in gilt with a sunken central medallion of a flower head encircled by interlocking ruyi-heads闁挎稑顔揾e wide flaring cavetto with unusual sprays of stylised floral motifs闁挎稑顔揾e reverse with a lotus flower meander闁挎稑鐣禷ch full bloom supporting one of the eight Buddhist Emblems闁挎稑鐣産ove a lappet band around the foot 闁挎稑娼祅e with small glaze chip to rim repaired闁,https://auction.artron.net/paimai-art16470794,https://image.artron.net/wd/auction//31/art/275/3a4e4cbaccf3fc9a7c4726f1ddf3c357.jpg,26,Dish,Qing,291500,373650,0,0,0,291500.0,3,0.854634146341463,2,D2
