Name,unique_id,Year of Work,Auction House,Session,Meeting,Sale of,Description,Product URL,Image URL,Size,Category,Period,Estimate RMB,Sold For RMB,China,T,China*T,Estimate,Size_c,weights,subclass,Stratum
Qingdao light turquoise green land pastel Fushou pattern gourd vase,1271,Qing Daoguang,China Guardian,Autumn Auction 2002 - Porcelain Furniture Crafts,China Guardian Autumn Auction 2002,03/11/2002,"The vase is in the form of a gourd, covered with turquoise green glaze inside and out, the mouth and footrim decorated with gold paint. The exterior of the vessel is painted in famille-rose enamels, with a ruyi cloud motif outside the mouth and below the waistband, a lotus petal motif on the shin, and an upper and lower motif with an entwined poinsettia pattern. This is a rare example of the Daoguang official kiln, with its exquisite production, rich colouring, and opulence.",https://auction.artron.net/paimai-art18470152,https://image.artron.net/wd/auction//5/art/460/6efa51cfa62352c055cc79012dc0e84a.jpg,27,Vase,Qing,500000,495000,1,1,1,500000.0,3,1.0,2,V2
Qing Kangxi blue and white phoenix wearing pattern phoenix tail zun vase,1274,Qing Kangxi,China Guardian,Autumn Auction 2002 - Porcelain Furniture Crafts,China Guardian Autumn Auction 2002,03/11/2002,"The standard form of the phoenix-tailed dzong is an open mouth with a narrow neck and broad shoulders and a flared foot. The entire body is painted in blue and white with a phoenix through a peony design, the painting smoothly flowing, the phoenixes vivid and the composition rich.",https://auction.artron.net/paimai-art18470136,https://image.artron.net/wd/auction//5/art/460/43a09ac57b8bdd7dcdd29efbfe583fab.jpg,45,Vase,Qing,70000,66000,1,1,1,70000.0,4,1.0,1,V1
Qing Jiaqing coral red painted gold treasure pattern amphora vase,1276,Qing Jiaqing,China Guardian,Autumn Auction 2002 - Porcelain Furniture Crafts,China Guardian Autumn Auction 2002,03/11/2002,"With a long neck and small mouth, decorated with double ears around the neck, and a long, rounded belly, the vase is of beautiful form. The coral-red ground is painted with gold-coloured motifs, the colours bright and brilliant, a rare example of official kiln work from the Jiaqing period. With repairs. See: 'Appreciation of Qing porcelain', p. 148.",https://auction.artron.net/paimai-art18470143,https://image.artron.net/wd/auction//5/art/460/ba32c239266bc148b0e809c1a00c913b.jpg,22,Vase,Qing,50000,44000,1,1,1,50000.0,3,1.0,2,V2
Qing Xuantong pastel cloud bat pattern appreciation vase,1277,Qing dynasty (1644-1911),China Guardian,Autumn Auction 2002 - Porcelain Furniture Crafts,China Guardian Autumn Auction 2002,03/11/2002,"With a skewed mouth and long neck, rounded belly and footrim. A standard shape for a Qing dynasty vase. The rim, shoulders, and shins are painted with a ruyi cloud-head motif, a longevity motif, and a lotus petal motif, while the neck and abdomen are painted with a full range of cloudy bat motifs, the composition dense, the motifs fine, and the colours bright. See: 'Appreciation of Porcelain of the Invitation Period', p. 303, fig. 407.",https://auction.artron.net/paimai-art18470168,https://image.artron.net/wd/auction//5/art/460/08bce094831b6cb97ec972072936349a.jpg,39,Vase,Qing,50000,93500,1,1,1,50000.0,4,1.0,1,V1
Qing Guangxu pastel cloud bat pattern vase,1281,Qing Guangxu,China Guardian,Autumn Auction 2002 - Porcelain Furniture Crafts,China Guardian Autumn Auction 2002,03/11/2002,"With a straight neck and sloping shoulders and a bulging footrim. The entire body is painted in famille rose enamels with a cloudy bat motif and a ruyi cloud motif, the mouth and foot decorated with a ruyi cloud motif and a lotus petal border, respectively, the mouth of the vase slightly bruised. See: 'Appreciation of the Painted Porcelain of the Invitation to the Dynasties', p. 270, fig. 358.",https://auction.artron.net/paimai-art18470164,https://image.artron.net/wd/auction//5/art/460/39d71a4f926149b7e299cd1c4b30c0b1.jpg,33,Vase,Qing,25000,30800,1,1,1,25000.0,4,1.0,1,V1
Qingdaoguang bean green glazed gourd vase,1296,Qing Daoguang,China Guardian,Autumn Auction 2002 - Porcelain Furniture Crafts,China Guardian Autumn Auction 2002,03/11/2002,"The shape is elegant and beautiful, imitating the form of a gourd. The skin is fine, dense and hard. The glaze is pure and moist, with a striated foot.",https://auction.artron.net/paimai-art18470196,https://image.artron.net/wd/auction//5/art/460/52c1122ec57202e44a2a024306c952ed.jpg,31,Vase,Qing,50000,49500,1,1,1,50000.0,4,1.0,1,V1
Late Qing Dynasty Jin Pinqing's Blue and White Bird and Flower Guan Er Zun vase,1298,TLate Qing,China Guardian,Autumn Auction 2002 - Porcelain Furniture Crafts,China Guardian Autumn Auction 2002,03/11/2002,"The vessel is of large and dignified form, the shoulders decorated with bamboo-jointed ears. The belly is painted with a parrot perched on a branch, with willow and peach tree motifs, the painting exquisite and subtle, with pure blue and white colouring. 銆坆r銆 Jin Pinqing, known as Pinqing Jushi, was active between Tongzhi and Guangxu, and worked at the Imperial Palace Guang in Yingdezhen. He specialised in lightly reddish-red landscapes and birds, mostly imitating the famous Southern Song artist and the celebrated Shen Shitian, while the birds and flowers were of the Huayan school, and the large porcelain pieces he produced were rare.",https://auction.artron.net/paimai-art18470203,https://image.artron.net/wd/auction//5/art/460/f6c8b6aeb27d96af74b760b214813664.jpg,55,Vase,Qing,135000,132000,1,1,1,135000.0,4,1.0,1,V1
Qing Guangxu pink green glazed fish basket zun vase,1302,Qing Guangxu,China Guardian,Autumn Auction 2002 - Porcelain Furniture Crafts,China Guardian Autumn Auction 2002,03/11/2002,"The body is carved with a wicker weave pattern, with two rope patterns on the mouth and shoulders, resembling a fish basket, and the body is glazed in pink and blue with a lustrous glaze.",https://auction.artron.net/paimai-art18470202,https://image.artron.net/wd/auction//5/art/460/cc33a8db4bea5c9a16d2f963a98d1d45.jpg,18,Vase,Qing,30000,27500,1,1,1,30000.0,2,1.0,5,V5
Qing Guangxu blue and white lotus pattern appreciation vase,1303,Qing Guangxu,China Guardian,Autumn Auction 2002 - Porcelain Furniture Crafts,China Guardian Autumn Auction 2002,03/11/2002,"The vase is of regular form, with nine layers of decoration throughout, the abdomen decorated with an entwined lotus pattern as the main motif. The colourful blue and white material and the lotus flower motifs are harmonious, meaning 'clean and honest', so this variety was often given to ministers by the emperor as a way to keep his officials clean and honest, hence the name of the vase.",https://auction.artron.net/paimai-art18470216,https://image.artron.net/wd/auction//5/art/460/7c42721ed8c4e965099701115238d888.jpg,38,Vase,Qing,40000,44000,1,1,1,40000.0,4,1.0,1,V1
Qing Guangxu blue and white bamboo stone banana diagram vase,1305,Qing Guangxu,China Guardian,Autumn Auction 2002 - Porcelain Furniture Crafts,China Guardian Autumn Auction 2002,03/11/2002,"The shape and painting are in the style of the Qianlong period, with six layers of decoration on the entire body, the blue and white floral colours being strong, the painting fine and the design regular, typical of the official kilns of the Qing dynasty.",https://auction.artron.net/paimai-art18470214,https://image.artron.net/wd/auction//5/art/460/f1d7874cd5b8d9af42a1d8e400524f8c.jpg,29,Vase,Qing,60000,99000,1,1,1,60000.0,3,1.0,2,V2
Qing Guangxu Sacrifice blue-glazed elephant ear square vase,1306,Qing Guangxu,China Guardian,Autumn Auction 2002 - Porcelain Furniture Crafts,China Guardian Autumn Auction 2002,03/11/2002,"A square vase in the form of a jadeite, flanked by double elephant-ears, the interior and exterior fully glazed in ceremonial blue, the glaze elegant and dignified.",https://auction.artron.net/paimai-art18470231,https://image.artron.net/wd/auction//5/art/460/5401f4a64c4eed9094ede4bd13cfa0ac.jpg,30,Vase,Qing,20000,19800,1,1,1,20000.0,4,1.0,1,V1
Qing Guangxu blue and white bamboo stone banana diagram jade pot spring vase,1309,Qing Guangxu,China Guardian,Autumn Auction 2002 - Porcelain Furniture Crafts,China Guardian Autumn Auction 2002,03/11/2002,"With a flared mouth and a bunched neck and a bulging footrim. The entire vessel is painted from top to bottom with six layers of decoration, including banana leaf, scrolling grass, ruyi cloud head, bamboo and banana, lotus petal and lotus flower borders, all of which are clearly layered and exquisitely painted and in good condition.",https://auction.artron.net/paimai-art18470218,https://image.artron.net/wd/auction//5/art/460/198ae953231ad96d5f26ca49eea2ecb6.jpg,29,Vase,Qing,60000,55000,1,1,1,60000.0,3,1.0,2,V2
Qing Guangxu eel yellow glazed water chestnut vase,1314,Qing Guangxu,China Guardian,Autumn Auction 2002 - Porcelain Furniture Crafts,China Guardian Autumn Auction 2002,03/11/2002,"With a straight mouth and long neck and flat rounded belly, the vessel is of formalized form. The eel-yellow glaze is uniform and elegant.",https://auction.artron.net/paimai-art18470235,https://image.artron.net/wd/auction//5/art/460/679890213ed8146963abfe7515be68e9.jpg,34,Vase,Qing,25000,22000,1,1,1,25000.0,4,1.0,1,V1
Qianlong eel yellow glazed jade pot spring vase,1315,Qing Qianlong,China Guardian,Autumn Auction 2002 - Porcelain Furniture Crafts,China Guardian Autumn Auction 2002,03/11/2002,"With a flared mouth and a bunched neck, and a draped belly and footrim. The body is covered with an eel-yellow glaze of uniform, warm colour.",https://auction.artron.net/paimai-art18470233,https://image.artron.net/wd/auction//5/art/460/5cfdf972e509d9be2e6579223a26665f.jpg,30,Vase,Qing,50000,44000,1,1,1,50000.0,4,1.0,1,V1
Clear pastel dragon pattern small celestial ball vase,1317,Qing,China Guardian,Autumn Auction 2002 - Porcelain Furniture Crafts,China Guardian Autumn Auction 2002,03/11/2002,"The mouth of the vase is slightly flared, with a long neck and bulging belly. The rim and shin are painted with a ruyi cloud-head motif and a lotus petal motif, while the main body is decorated in famille rose with a dragon motif, bats, and auspicious clouds, the body of the dragon spreading out in a vivid manner.",https://auction.artron.net/paimai-art18470246,https://image.artron.net/wd/auction//5/art/460/5d3185b0ae604bfe488e915f2b6dc8ab.jpg,18,Vase,Qing,50000,44000,1,1,1,50000.0,2,1.0,5,V5
Qing Kangxi Blue and white character Phoenix Tail Zun vase,1322,Qing Kangxi,China Guardian,Spring 2002 Auction - Porcelain and Jade Crafts,China Guardian Spring Auction 2002,23/04/2002,"The neck is narrowed and the shoulders are broad and the belly converging. The upper and lower panels are painted with two groups of operatic figures in muted blue and white, the figures vividly evocative. A small wound to the mouth.",https://auction.artron.net/paimai-art16680003,https://image.artron.net/wd/auction//5/art/338/7e05c77e809e06bf3675cc7fafe2083f.jpg,44,Vase,Qing,40000,33000,1,0,0,40000.0,4,1.0,1,V1
Qing Kangxi Blue and white tangle floral pattern phoenix tail zun vase,1323,Qing Kangxi,China Guardian,Spring 2002 Auction - Porcelain and Jade Crafts,China Guardian Spring Auction 2002,23/04/2002,"The foot surrounded by a rounded belly and the straight neck with an open mouth. The entire body is painted with a continuous design of entwined peonies, the composition of which is exquisitely detailed and smoothly executed, the colour of the blue and green. The foot is slightly crumbling.",https://auction.artron.net/paimai-art16680019,https://image.artron.net/wd/auction//5/art/338/c07af010a5045ba4c07491839c99c676.jpg,47,Vase,Qing,50000,44000,1,0,0,50000.0,4,1.0,1,V1
Qing Kangxi Blue and white opera character picture stick mallet vase,1327,Qing Kangxi,China Guardian,Spring 2002 Auction - Porcelain and Jade Crafts,China Guardian Spring Auction 2002,23/04/2002,"The vessel is of regular form, with red and greasy skin and a moist white glaze. The painted bamboo, rocks and bananas are clearly layered, and the operatic figures are vivid and evocative, the blue and white colours are rich and lustrous, and the painting process is incomparably refined.",https://auction.artron.net/paimai-art16680009,https://image.artron.net/wd/auction//5/art/338/672529bb081205b385823709fb54800e.jpg,42,Vase,Qing,100000,93500,1,0,0,100000.0,4,1.0,1,V1
Qing Kangxi Blue and white fisherman Letu flower vase,1328,Qing Kangxi,China Guardian,Spring 2002 Auction - Porcelain and Jade Crafts,China Guardian Spring Auction 2002,23/04/2002,"The upper, middle and lower parts of the goblet are divided into three groups, the upper and lower groups with fishermen's landscapes, and the middle part with a drum-like protrusion painted with flowers of the four seasons, the overall layout sparse and dense. The white glaze applied is typical of the Kangxi period, making the colour of the blue and white even more verdant and elegant, making it one of the finest pieces of Kangxi blue and white porcelain.",https://auction.artron.net/paimai-art16680008,https://image.artron.net/wd/auction//5/art/338/170547a4f79ae3c4609fea3c2fb8f731.jpg,46,Vase,Qing,85000,104500,1,0,0,85000.0,4,1.0,1,V1
Qing Kangxi Blue and white baby play picture flower vase,1331,Qing Kangxi,China Guardian,Spring 2002 Auction - Porcelain and Jade Crafts,China Guardian Spring Auction 2002,23/04/2002,"The top and bottom of the goblet are painted with three groups of figures, with pure blue and white hair colour, sparse and well-defined composition, and exquisite and delicate painting, making it a standard piece of folk kiln blue and white porcelain of the Kangxi period.",https://auction.artron.net/paimai-art16680007,https://image.artron.net/wd/auction//5/art/338/ae75e04bcbbb551fbcf2b677042f1e24.jpg,44,Vase,Qing,42500,60500,1,0,0,42500.0,4,1.0,1,V1
Qing Kangxi blue-and-white flower bird pattern small flower vase,1336,Qing Kangxi,China Guardian,Spring 2002 Auction - Porcelain and Jade Crafts,China Guardian Spring Auction 2002,23/04/2002,"The goblet is flat-footed, with an open mouth at the waist, the small vessel with a large design. Of fine texture and white glaze. Painted in blue and white with flowers, butterflies and birds. The composition is sparse, the painting smooth and the colour verdant.",https://auction.artron.net/paimai-art16680017,https://image.artron.net/wd/auction//5/art/338/91eb3de3e4a29a43d2afd7ab6adbc4ae.jpg,20,Vase,Qing,15000,13200,1,0,0,15000.0,3,1.0,2,V2
Qing Kangxi blue-and-white flower bird pattern small flower vase,1338,Qing Kangxi,China Guardian,Spring 2002 Auction - Porcelain and Jade Crafts,China Guardian Spring Auction 2002,23/04/2002,"The goblet is handsome, with a rich white glaze and lustrous blue and white floral colour, and two darkly incised borders on the upper and lower rims, the central part painted with birds and flowers, a standard vessel of this type in the Kangxi period.",https://auction.artron.net/paimai-art16680016,https://image.artron.net/wd/auction//5/art/338/69534c33b6332369c0da062d0c5be025.jpg,20,Vase,Qing,20000,16500,1,0,0,20000.0,3,1.0,2,V2
Qianlong Qinglong Blue and white tangle pattern paved the head vase,1344,Qing Qianlong,China Guardian,Spring 2002 Auction - Porcelain and Jade Crafts,China Guardian Spring Auction 2002,23/04/2002,"With a skirted neck and paved shoulders, the elegantly shaped vessel is painted throughout with six layers of decoration, including seawater, banana leaves, entwined lotus leaves and lotus petals, in clear, fluid strokes and richly coloured blue, typical of Qianlong blue and white porcelain.",https://auction.artron.net/paimai-art16680030,https://image.artron.net/wd/auction//5/art/338/850fcf62d893fa8bffa69270ae1721d1.jpg,25,Vase,Qing,150000,176000,1,0,0,150000.0,3,1.0,2,V2
Qingqianlong blue and white double dragon holding the birthday pattern ribbon gourd vase,1345,Qing Qianlong,China Guardian,Spring 2002 Auction - Porcelain and Jade Crafts,China Guardian Spring Auction 2002,23/04/2002,"A gourd-shaped flat vase with ruyi ears on either side of the vase. The entire body is painted in blue and white, the lower part of the vase painted with two dragons holding a longevity symbol and the upper part with a bat surrounded by a flower-shaped dragon's tail, suggesting 'longevity and happiness'.",https://auction.artron.net/paimai-art16680029,https://image.artron.net/wd/auction//5/art/338/53c592d67d7ccee5985a31c16872f04d.jpg,21,Vase,Qing,175000,275000,1,0,0,175000.0,3,1.0,2,V2
Qianlong Qinghua bamboo stone banana figure vase,1348,Qing Qianlong,China Guardian,Spring 2002 Auction - Porcelain and Jade Crafts,China Guardian Spring Auction 2002,23/04/2002,"With a flared mouth and a bunched neck, and a heavy belly and footrim. The entire vessel is painted from the top down with six layers of decoration, including banana leaves, entwined scrolling grasses, ruyi clouds, bamboo and banana, and lotus petals and lotus flowers, all of which are clearly defined and exquisitely painted. The blue and white porcelain in the Tianminlou Collection, fig. 93.",https://auction.artron.net/paimai-art16680031,https://image.artron.net/wd/auction//5/art/338/60378087a19b0516db9163628e61366c.jpg,28,Vase,Qing,430000,418000,1,0,0,430000.0,3,1.0,2,V2
Qianlong Qinglong blue-and-white lotus pattern elephant ear flat vase,1351,Qing Qianlong,China Guardian,Spring 2002 Auction - Porcelain and Jade Crafts,China Guardian Spring Auction 2002,23/04/2002,"The vase has a flat, square body with a set of ringed elephant ears stacked on the shoulders, a neck painted with a group of phoenixes, and a body painted with an entwined lotus design with lotus petals and tangcao on the shin. A fine example of Qianlong folk-art blue and white.",https://auction.artron.net/paimai-art16680038,https://image.artron.net/wd/auction//5/art/338/6d8554646e7f1163aab30074bbe220bb.jpg,36,Vase,Qing,30000,27500,1,0,0,30000.0,4,1.0,1,V1
Qianlong Qingqianlong blue and white lotus bagua pattern flat vase,1353,Qing Qianlong,China Guardian,Spring 2002 Auction - Porcelain and Jade Crafts,China Guardian Spring Auction 2002,23/04/2002,"The shape is novel and unusual, and very rare. The vase is decorated with a pair of ruyi ears on either side of a straight neck, the body flat and rounded, the shoulders stacked with a set of looped ears, the centre of the front of the vase protruding, similar to the moon vase of Yongle in the early Ming dynasty, the back of the vase horizontal, decorated with a dense and orderly design, with a total of nine layers of decoration, the centre of both sides of the vase decorated with chi dragons holding eight trigrams. On the front, '鈮' indicates Qian, and on the back, '鈮♀墶' indicates Kun, which in the I Ching represents heaven and earth, and is therefore also known as the Qiankun vase. The blue and white colour and superbly painted, this was a deliberate court vessel during the Qianlong period. See: The Cloud and Sea Pavilion - Important Ancient Chinese Ceramics - The Zhang Zongxian Collection, Christie's, London, dish 87.",https://auction.artron.net/paimai-art16680032,https://image.artron.net/wd/auction//5/art/338/51ad6263be3beff771b0f6b44253a92b.jpg,37,Vase,Qing,2300000,2530000,1,0,0,2300000.0,4,1.0,1,V1
Qingqianlong bean green glaze blue and white glaze red flower butterfly pattern vase,1373,Qing Qianlong,China Guardian,Spring 2002 Auction - Porcelain and Jade Crafts,China Guardian Spring Auction 2002,23/04/2002,"The mouth of the vase has a girdled neck, with a plump shoulder and a closed belly, the shoulders decorated with bat handles, the body painted on one side with a blue and red glazed chrysanthemum and butterfly design, the other side inscribed with a poetic inscription. The glaze is pure douqing, and the blue and blue glaze is vividly coloured in red.",https://auction.artron.net/paimai-art16680069,https://image.artron.net/wd/auction//5/art/338/e33bfa3935eec8f064c1e73af8e5a941.jpg,36,Vase,Qing,40000,33000,1,0,0,40000.0,4,1.0,1,V1
Clear pastel magpie denmei big sky ball vase,1375,Qing,China Guardian,Spring 2002 Auction - Porcelain and Jade Crafts,China Guardian Spring Auction 2002,23/04/2002,"The neck of the vase is straight and long, and the spherical belly is rounded and magnificent. Painted in famille rose enamels, the vase is decorated with twelve magpies perched in various poses on the branches of a plum blossom, with two deep and shallow branches, red and white plum blossoms, as well as lingzhi and verdant orchids, signifying the arrival of spring and the arrival of joyous events. """"The 'magpie on plum' is one of the most popular and auspicious motifs in Chinese folklore. It is an exquisite, colourful and well-preserved vase, and very rare in heirloom form.",https://auction.artron.net/paimai-art16680083,https://image.artron.net/wd/auction//5/art/338/e0d44f72b166fe4037ede2b4e360da27.jpg,56,Vase,Qing,275000,550000,1,0,0,275000.0,4,1.0,1,V1
Qing Tongzhi kiln glaze through the ear zun vase,1386,Qing Tongzhi,China Guardian,Spring 2002 Auction - Porcelain and Jade Crafts,China Guardian Spring Auction 2002,23/04/2002,"The flat, square body of the vase is decorated on both sides of the neck with pierced ears. The entire body is covered with a kiln-formed glaze that flows naturally and smoothly. The ears are trimmed.",https://auction.artron.net/paimai-art16680097,https://image.artron.net/wd/auction//5/art/338/1f3f04e848b96c6c711022118c597c8c.jpg,30,Vase,Qing,16000,13200,1,0,0,16000.0,4,1.0,1,V1
Qianlong kiln glaze through the ear square vase,1389,Qing Qianlong,China Guardian,Spring 2002 Auction - Porcelain and Jade Crafts,China Guardian Spring Auction 2002,23/04/2002,"The flat, square body of the vase is decorated with a pair of side handles and a convex apricot rounded decoration on the abdomen. The body is fully decorated with kiln-glaze, the glaze naturally draped and the colour of the glaze brilliant. This is a traditional variety of porcelain from the official kilns of the Qing dynasty.",https://auction.artron.net/paimai-art16680095,https://image.artron.net/wd/auction//5/art/338/fa2169381ef458f9eff329874621019c.jpg,30,Vase,Qing,70000,132000,1,0,0,70000.0,4,1.0,1,V1
Qing Yongzheng sacrifices red-glazed plum vases,1390,Qing Yongzheng,China Guardian,Spring 2002 Auction - Porcelain and Jade Crafts,China Guardian Spring Auction 2002,23/04/2002,"It is a smooth, curved vase of beautiful form. The interior of the mouth is glazed with a solid white glaze, while the body of the vase is glazed with a rich red ritual, the glaze as bright and beautiful as that of the Xuande ox-blood red. This is undoubtedly an official's kiln product, but the glaze on the base and the mark are worn. (see: 'Collection of Cultural Treasures from the Palace Museum - Colour Glazes', fig. 24)",https://auction.artron.net/paimai-art16680098,https://image.artron.net/wd/auction//5/art/338/abc7b248349b33e492300ad075fde441.jpg,30,Vase,Qing,30000,46200,1,0,0,30000.0,4,1.0,1,V1
Qianlong sacrifice red glazed plum vase,1392,Qing Qianlong,China Guardian,Spring 2002 Auction - Porcelain and Jade Crafts,China Guardian Spring Auction 2002,23/04/2002,"The small mouth and broad shoulders are tapered below the shoulders. The mouth and interior of the vase are covered with white glaze, the body of the vase with a rich glaze of red undergarment.",https://auction.artron.net/paimai-art16680100,https://image.artron.net/wd/auction//5/art/338/6451024fd81659cb77693c6cc3193e9d.jpg,22,Vase,Qing,27000,24200,1,0,0,27000.0,3,1.0,2,V2
Kiyoshunji Blue and white plantain character vase,1395,Qing Shunzhi,China Guardian,Spring 2002 Auction - Porcelain and Jade Crafts,China Guardian Spring Auction 2002,23/04/2002,"The neck is tied with a flared mouth, tapering to a cylindrical shape below the shoulders. The mouth is glazed with a line of sauce, a characteristic feature of this period. The neck of the vase is painted with two groups of exquisite stones, and the body with a group of banana figures, accompanied by the poetic phrase 'The iron flute blows long yellow grass, and the red dust fills the ground'. The overall composition is sparse, simple and elegant. Small wound to the mouth.",https://auction.artron.net/paimai-art16680115,https://image.artron.net/wd/auction//5/art/338/2fbdba10656476370ce749be9cca91d0.jpg,43,Vase,Qing,50000,44000,1,0,0,50000.0,4,1.0,1,V1
Qianlong peacock green glazed flower vase,1396,Qing Qianlong,China Guardian,Spring 2002 Auction - Porcelain and Jade Crafts,China Guardian Spring Auction 2002,23/04/2002,"In the shape of a pre-Qin bronze vessel with a flared mouth and elongated neck, the foot flared further outwards near the foot. The body and foot are covered with a low-temperature peacock-green glaze, the glaze richly and finely flaked, and decorated with elongated underglaze banana-leaf and taotie motifs, a rare and precious variety. Ground mouth.",https://auction.artron.net/paimai-art16680129,https://image.artron.net/wd/auction//5/art/338/82d692ace53e12c65257fe46cab71505.jpg,28,Vase,Qing,50000,107800,1,0,0,50000.0,3,1.0,2,V2
Qing Guangxu Sacrifice blue glaze depicted gold elephant ear square vase,1397,Qing Guangxu,China Guardian,Spring 2002 Auction - Porcelain and Jade Crafts,China Guardian Spring Auction 2002,23/04/2002,"The square-shaped vase with a rounded mouth and footrim is decorated on both sides with elephant-headed ears. The vase is decorated with gold paint around the body, with landscape scenes on two sides and floral motifs on both sides, the composition compact and finely painted.",https://auction.artron.net/paimai-art16680124,https://image.artron.net/wd/auction//5/art/338/f5e372812aa3f9bfcb542eb9fe674538.jpg,29,Vase,Qing,15000,11000,1,0,0,15000.0,3,1.0,2,V2
